Country,Most recent data as of 2019,Most recent data as of 2019_Footnote
Mali,2.5,"Source: ANALYSE DE LA SITUATION DES PERSONNES TRANSGENRES AU MALI EN RELATION AVEC L'INFECTION A VIH ET LE SIDA"
Panama,0,"Source: Registro de  Cinco de las Seis Clínicas Amigables (CLAM) donde se llevan a cabo las Vigilancia Centinela de las ITS (VICITS)"
Paraguay,23,"Source: PREVALENCIA DEL VIH/SIFILIS/HEPATITIS B Y COMPORTAMIENTOS, PRÁCTICAS Y ACTITUDES DE LA POBLACION TRANS EN EL PARAGUAY, 2017"
Peru,2.3,"Source: Hoja de Monitorización de Actividades - HMA de la Dirección de Prevención y Control de VIH-SIDA, Enfermedades de Transmisión Sexual y Hepatitis - DPVIH"
Samoa,0,"Source: Outreach Registers from all NGO's and the Ministry of Health's HIV/STI outreach programmes"
Sierra Leone,22.4,"Source: HIV Sero - Prevalence Study for Key Populations May 2015"
United States,2,"Source: Becasen, J et al (2019). Estimating the prevalence of HIV and sexual behaviors among the US Transgender population: A systematic review and meta analysis, 2006-2017. AJPH, 109 (1), e1-e8."